{
  "artifacts": [
    {
      "kind": "layout_proxy_scene",
      "path": "work/flat_planetary_gear_assembly/review/layout/layout_proxy.scene.json"
    },
    {
      "kind": "source",
      "path": "work/flat_planetary_gear_assembly/review/source/layout_proxy_build123d.py"
    },
    {
      "kind": "step",
      "path": "work/flat_planetary_gear_assembly/review/source/layout_proxy_build123d.step"
    },
    {
      "kind": "viewer",
      "path": "work/flat_planetary_gear_assembly/review/viewer_link.html"
    },
    {
      "kind": "snapshot",
      "path": "work/flat_planetary_gear_assembly/review/viewer_snapshot.png"
    },
    {
      "kind": "snapshot",
      "path": "work/flat_planetary_gear_assembly/review/layout_snapshot.png"
    }
  ],
  "evidence_policy": [
    "Viewer targets are review evidence only.",
    "Geometry measurements, kernel checks, and source-level carry-through remain the stronger completion evidence.",
    "Screenshots or browser previews must not be used as final engineering certification."
  ],
  "extensions": {
    "packager": "tools/package_review_bundle.py",
    "proceed_gate": "work/flat_planetary_gear_assembly/review/proceed_gate.json"
  },
  "id": "flat_planetary_gear_assembly.review_bundle",
  "kind": "review_bundle",
  "limitations": [
    "Downstream CAD geometry checks are still required before proceed review.",
    "Fillet features are generated with a cylinder/torus approximation because this local build123d/OCP runtime cannot reliably enumerate edges for selector-based filleting.",
    "Generated STEP is a layout/detail candidate from generated build123d source, not engineering certification.",
    "Inspection covers kernel-neutral scene contract only.",
    "Inspection verifies source-level carry-through, not generated STEP geometry.",
    "Layout snapshot is schematic visual evidence; STEP geometry and Boolean reports are authoritative.",
    "Ring tooth-space backlash is represented by a 1.01x XY scaled cutter in the review proxy.",
    "Run downstream CAD generation and geometry inspection before final proceed approval.",
    "Scene carries skipped geometry checks that require a CAD harness.",
    "Some cylindrical edge rounds are torus-based build123d approximations rather than selector-derived topology fillets.",
    "Static Boolean checks do not certify load capacity, efficiency, noise, lubrication, or manufacturability.",
    "Viewer snapshots are review evidence only and do not replace geometry checks."
  ],
  "locked_layout_facts": [
    "separate_bodies_locked",
    "planet_radius_locked",
    "gear_axes_parallel_locked",
    "involute_teeth_locked",
    "no_tooth_overlap_locked",
    "module_locked_ring_mesh_locked",
    "premium_detail_non_mesh_locked"
  ],
  "next_actions": [
    "Open viewer targets to inspect layout readability and obvious placement drift.",
    "Approve proceed only if locked layout facts and skipped-check limitations are acceptable.",
    "Run downstream CAD generation and geometry inspection before final readiness claims."
  ],
  "reports": [
    {
      "kind": "inspection_report",
      "path": "work/flat_planetary_gear_assembly/review/layout/locked_facts.inspection_report.json"
    },
    {
      "kind": "inspection_report",
      "path": "work/flat_planetary_gear_assembly/review/source/source.inspection_report.json"
    },
    {
      "kind": "inspection_report",
      "path": "work/flat_planetary_gear_assembly/review/source/cad_generation.inspection_report.json"
    },
    {
      "kind": "inspection_report",
      "path": "work/flat_planetary_gear_assembly/review/source/step_geometry_supplemental.inspection_report.json"
    },
    {
      "kind": "inspection_report",
      "path": "work/flat_planetary_gear_assembly/review/viewer_snapshot.inspection_report.json"
    },
    {
      "kind": "inspection_report",
      "path": "work/flat_planetary_gear_assembly/review/layout_snapshot.inspection_report.json"
    }
  ],
  "schema_version": "0.8.0",
  "spec_id": "flat_planetary_gear_assembly",
  "status": "ready_for_viewer_review",
  "viewer_targets": [
    {
      "evidence_role": "review_only",
      "path": "work/flat_planetary_gear_assembly/review/layout/layout_proxy.scene.json",
      "viewer_hint": "Open as layout context if the active viewer supports Zen CAD scene JSON."
    },
    {
      "evidence_role": "review_only",
      "path": "work/flat_planetary_gear_assembly/review/source/layout_proxy_build123d.py",
      "viewer_hint": "Use as source-of-truth context for downstream CAD generation, not as visual evidence."
    },
    {
      "evidence_role": "review_only",
      "path": "work/flat_planetary_gear_assembly/review/source/layout_proxy_build123d.step",
      "viewer_hint": "Open as the generated CAD model; visual review does not replace geometry checks."
    },
    {
      "evidence_role": "review_only",
      "path": "work/flat_planetary_gear_assembly/review/viewer_link.html",
      "viewer_hint": "Open this local CAD Viewer link when the viewer server is running."
    },
    {
      "evidence_role": "review_only",
      "path": "work/flat_planetary_gear_assembly/review/viewer_snapshot.png",
      "viewer_hint": "Use this saved viewer snapshot for visual review only; geometry checks remain authoritative."
    },
    {
      "evidence_role": "review_only",
      "path": "work/flat_planetary_gear_assembly/review/layout_snapshot.png",
      "viewer_hint": "Use this saved viewer snapshot for visual review only; geometry checks remain authoritative."
    }
  ]
}
